,Rank,Artist,Song,Year,Artist_ID,Genre,Followers,Img
79,1, The Glenn Miller Orchestra, Moonlight Cocktail,1942,7yJ74d8IUMgW1u8CHgxU6U,unassigned,268,https://i.scdn.co/image/8c0a148cd2d5033cc3dd3b44cc3c5957e6e9c6f9
80,2, The Glenn Miller Orchestra, (I've Got a Gal In) Kalamazoo,1942,7yJ74d8IUMgW1u8CHgxU6U,unassigned,268,https://i.scdn.co/image/8c0a148cd2d5033cc3dd3b44cc3c5957e6e9c6f9
81,3, Tommy Dorsey and His Orchestra, There Are Such Things,1942,10nZMl7o7nE6EEXqFT0UUK,unassigned,11,https://i.scdn.co/image/ebeed20f4656e51d8f156639275b4f27fd325e86
82,4, Bing Crosby, White Christmas,1942,6ZjFtWeHP9XN7FeKSUe80S,adult standards,186651,https://i.scdn.co/image/bce578f0f9138f68d8868b1b7c0a2b11bffaab78
83,5, Harry James and His Orchestra, I Had the Craziest Dream,1942,1eyNnEUKJSZP6LkQ3fRMZi,unassigned,11,https://i.redd.it/6dg6m5e556m11.jpg
84,6, Harry James and His Orchestra, Sleepy Lagoon,1942,1eyNnEUKJSZP6LkQ3fRMZi,unassigned,11,https://i.redd.it/6dg6m5e556m11.jpg
85,7, Jimmy Dorsey and His Orchestra, Tangerine,1942,3z5VqEvu6RJ4Abtah3lTsg,big band,5779,https://i.scdn.co/image/3f8668b7088547d526e23e507e24b00a10e0a6f4
86,8, Kay Kyser and His Orchestra, Jingle Jangle Jingle,1942,23NUp4EWSmMANtTosuwrGS,unassigned,2524,https://i.scdn.co/image/02be09dbaeb8c7185c1d156ac99f110b19b35d53
87,9, Woody Herman and His Orchestra, Blues in the Night (My Mama Done TolMe),1942,7CUcJMFBfSARR8js036QOn,big band,3824,https://i.scdn.co/image/d8b6f2508333a60f0193e05c310f06af6c8f486b
88,10, The Glenn Miller Orchestra, A String of Pearls,1942,7yJ74d8IUMgW1u8CHgxU6U,unassigned,268,https://i.scdn.co/image/8c0a148cd2d5033cc3dd3b44cc3c5957e6e9c6f9
89,11, The Glenn Miller Orchestra, Don't Sit Under the Apple Tree (With Anyone else But Me),1942,7yJ74d8IUMgW1u8CHgxU6U,unassigned,268,https://i.scdn.co/image/8c0a148cd2d5033cc3dd3b44cc3c5957e6e9c6f9
90,12, Kay Kyser and His Orchestra, Who Wouldnt Love You,1942,23NUp4EWSmMANtTosuwrGS,unassigned,2524,https://i.scdn.co/image/02be09dbaeb8c7185c1d156ac99f110b19b35d53
91,13, Benny Goodman and His Orchestra, Jersey Bounce,1942,44op4qIuRteX82594vAhMn,unassigned,867,https://i.redd.it/6dg6m5e556m11.jpg
92,14, The Glenn Miller Orchestra, Serenade in Blue,1942,7yJ74d8IUMgW1u8CHgxU6U,unassigned,268,https://i.scdn.co/image/8c0a148cd2d5033cc3dd3b44cc3c5957e6e9c6f9
93,15, Vaughn Monroe, When the Lights Go On Again (All Over the World),1942,5TD3Mad384osX9K8DLkx7L,adult standards,5200,https://i.scdn.co/image/4a9b56f7d1333bef94bca6d986ea47767d5c0c35
94,16, Kay Kyser and His Orchestra, Praise the Lord and Pass the Ammunition!,1942,23NUp4EWSmMANtTosuwrGS,unassigned,2524,https://i.scdn.co/image/02be09dbaeb8c7185c1d156ac99f110b19b35d53
95,17, Harry James and His Orchestra, I Don't Want to Walk without You,1942,1eyNnEUKJSZP6LkQ3fRMZi,unassigned,11,https://i.redd.it/6dg6m5e556m11.jpg
96,18, Charlie Spivak and His Orchestra, My Devotion,1942,6TsDdnJujwhkuAzXkqqsUE,unassigned,99,https://i.scdn.co/image/204e726017af12f05d7b381dbe680eb67d25fd80
97,19, Kay Kyser and His Orchestra, He Wears a Pair of Silver Wings,1942,23NUp4EWSmMANtTosuwrGS,unassigned,2524,https://i.scdn.co/image/02be09dbaeb8c7185c1d156ac99f110b19b35d53
98,20, Alvino Rey and His Orchestra, I Said No!,1942,4DxQK7b2NmfwBZyF7IqRIM,unassigned,0,https://i.redd.it/6dg6m5e556m11.jpg
99,21, Five, Mister Five,1942,04gDigrS5kc9YWfZHwBETP,pop,13064111,https://i.scdn.co/image/4079ef5effe54ab8cc099e2b6d872899d033b09d
100,22, Spike Jones and His City Slickers, Der Fuehrers Face,1942,3LPgSuOiE17GPcZ4ACDwlL,comic,1499,https://i.scdn.co/image/8f4033f3c1fec035f4953ec6bf5d6b5103fa0137
101,23, Tommy Dorsey and His Orchestra, Just As Though You Were Here,1942,10nZMl7o7nE6EEXqFT0UUK,unassigned,11,https://i.scdn.co/image/ebeed20f4656e51d8f156639275b4f27fd325e86
102,24, Alvino Rey and His Orchestra, Deep in the Heart of Texas,1942,4DxQK7b2NmfwBZyF7IqRIM,unassigned,0,https://i.redd.it/6dg6m5e556m11.jpg
103,25, Swing and Sway with Sammy Kaye, I Left My Heart At the Stage Door Can'teen,1942,6DZ2bVND1yFu4RX1CCliFE,unassigned,14,https://i.redd.it/6dg6m5e556m11.jpg
104,26, Bing Crosby, Deep in the Heart of Texas,1942,6ZjFtWeHP9XN7FeKSUe80S,adult standards,186651,https://i.scdn.co/image/bce578f0f9138f68d8868b1b7c0a2b11bffaab78
105,27, Swing and Sway with Sammy Kaye, Remember Pearl Harbor,1942,6DZ2bVND1yFu4RX1CCliFE,unassigned,14,https://i.redd.it/6dg6m5e556m11.jpg
106,28, Harry James and His Orchestra, One Dozen Roses,1942,1eyNnEUKJSZP6LkQ3fRMZi,unassigned,11,https://i.redd.it/6dg6m5e556m11.jpg
107,29, The Merry Macs, Jingle Jangle Jingle,1942,1GdTErb29TNkiEGWrNGAeH,big band,756,https://i.scdn.co/image/a52b1fbf0828f1a6eb6367210a691536e932539d
108,30, Dinah Shore, Blues in the Night,1942,73xrrv4ZrlpLi1q0Q34wiK,adult standards,24637,https://i.scdn.co/image/ff632972b9ff4934fc9aa280049fbf892e19776a
109,31, Jimmie Lunceford and His Orchestra, Blues in the Night (My Mama Done TolMe) (Parts 1 & 2),1942,5C1s7og01vLEIGIMMoLraQ,big band,317,https://i.scdn.co/image/fcf6c13537d50a84353bb4a4b1610bafcad19c7d
110,32, Benny Goodman and His Orchestra, I'daho,1942,44op4qIuRteX82594vAhMn,unassigned,867,https://i.redd.it/6dg6m5e556m11.jpg
111,33, Abe Lyman and His Californians, Amen,1942,3DxTcNTZBxqje8Me5qGkIf,vintage jazz,48,https://i.redd.it/6dg6m5e556m11.jpg
112,34, Russ Morgan, Somebody Else Is Taking My Place,1942,2yvPlnxRWTogtl4YdUSaIO,unassigned,118,https://i.scdn.co/image/c94d28a8bcfe572a4cb347751591b66b04761b53
113,35, Benny Goodman and His Orchestra, Somebody Else Is Taking My Place,1942,44op4qIuRteX82594vAhMn,unassigned,867,https://i.redd.it/6dg6m5e556m11.jpg
114,36, Harry James and His Orchestra, Strictly Instrumental,1942,1eyNnEUKJSZP6LkQ3fRMZi,unassigned,11,https://i.redd.it/6dg6m5e556m11.jpg
115,37, Vaughn Monroe, My Devotion,1942,5TD3Mad384osX9K8DLkx7L,adult standards,5200,https://i.scdn.co/image/4a9b56f7d1333bef94bca6d986ea47767d5c0c35
116,38, Woody Herman and His Orchestra, Amen,1942,7CUcJMFBfSARR8js036QOn,big band,3824,https://i.scdn.co/image/d8b6f2508333a60f0193e05c310f06af6c8f486b
117,39, Tommy Dorsey and His Orchestra, Take Me,1942,10nZMl7o7nE6EEXqFT0UUK,unassigned,11,https://i.scdn.co/image/ebeed20f4656e51d8f156639275b4f27fd325e86
118,40, Kay Kyser and His Orchestra, Strip Polka,1942,23NUp4EWSmMANtTosuwrGS,unassigned,2524,https://i.scdn.co/image/02be09dbaeb8c7185c1d156ac99f110b19b35d53
119,42, The Andrews Sisters, Strip Polka,1942,2NCGI6dLTxLdI9XHdv7QfM,adult standards,69409,https://i.scdn.co/image/53ddd415ed44e1dd1f33a66a27a6edd2ab020661
120,43, Five, Mr Five,1942,04gDigrS5kc9YWfZHwBETP,pop,13064111,https://i.scdn.co/image/4079ef5effe54ab8cc099e2b6d872899d033b09d
121,44, The Glenn Miller Orchestra, Sweet Eloise,1942,7yJ74d8IUMgW1u8CHgxU6U,unassigned,268,https://i.scdn.co/image/8c0a148cd2d5033cc3dd3b44cc3c5957e6e9c6f9
122,45, The Glenn Miller Orchestra, Skylark,1942,7yJ74d8IUMgW1u8CHgxU6U,unassigned,268,https://i.scdn.co/image/8c0a148cd2d5033cc3dd3b44cc3c5957e6e9c6f9
123,46, The Glenn Miller Orchestra, Juke Box Saturday Night,1942,7yJ74d8IUMgW1u8CHgxU6U,unassigned,268,https://i.scdn.co/image/8c0a148cd2d5033cc3dd3b44cc3c5957e6e9c6f9
124,47, The Glenn Miller Orchestra, Everything I Love,1942,7yJ74d8IUMgW1u8CHgxU6U,unassigned,268,https://i.scdn.co/image/8c0a148cd2d5033cc3dd3b44cc3c5957e6e9c6f9
125,48, Johnny Mercer, Strip Polka,1942,5cBHm2CXrbncYIDzrxF4Vi,adult standards,8853,https://i.scdn.co/image/98f75c6fc027a014ce6b0150b4142a05e5a51b18
126,49, Freddie Slack and His Orchestra, Cow-Cow Boogie,1942,4sDUl3F44oqvU3YQm8HmBw,unassigned,38,https://i.redd.it/6dg6m5e556m11.jpg
127,50, Horace Heidt and His Musical Knights, Deep in the Heart of Texas,1942,71EDwhmGGw7PlLGTm99jCK,unassigned,55,https://i.scdn.co/image/adac2eeb76ed05ee411612ba927c7c4735968bee
128,51, Kay Kyser and His Orchestra, (Therell Be Bluebirds Over) The White Cliffs of Dover,1942,23NUp4EWSmMANtTosuwrGS,unassigned,2524,https://i.scdn.co/image/02be09dbaeb8c7185c1d156ac99f110b19b35d53
129,52, Dinah Shore, One Dozen Roses,1942,73xrrv4ZrlpLi1q0Q34wiK,adult standards,24637,https://i.scdn.co/image/ff632972b9ff4934fc9aa280049fbf892e19776a
130,53, The Merry Macs, Praise the Lord and Pass the Ammunition!,1942,1GdTErb29TNkiEGWrNGAeH,big band,756,https://i.scdn.co/image/a52b1fbf0828f1a6eb6367210a691536e932539d
131,54, Dinah Shore, Miss You,1942,73xrrv4ZrlpLi1q0Q34wiK,adult standards,24637,https://i.scdn.co/image/ff632972b9ff4934fc9aa280049fbf892e19776a
132,55, Kate Smith, Rose ODay (The Filla-Ga-Dusha Song),1942,1oTc5uL1Jrp1VwqdJrW7TT,unassigned,590,https://i.scdn.co/image/3fe77e43a09474c7db5f7ff22622a49d622cb228
133,56, Glen Gray and the Casa Loma Orchestra, One Dozen Roses,1942,037LqLNDfDvFupasyqgreK,big band,881,https://i.scdn.co/image/e870571d143b4cbcc51015606d6a86bb4af5d80b
134,57, Kay Kyser and His Orchestra, Johnny Doughboy Found a Rose in Ireland,1942,23NUp4EWSmMANtTosuwrGS,unassigned,2524,https://i.scdn.co/image/02be09dbaeb8c7185c1d156ac99f110b19b35d53
135,58, Charlie Spivak and His Orchestra, This Is No Laughing Matter,1942,6TsDdnJujwhkuAzXkqqsUE,unassigned,99,https://i.scdn.co/image/204e726017af12f05d7b381dbe680eb67d25fd80
136,59, Alvino Rey and His Orchestra, Strip Polka,1942,4DxQK7b2NmfwBZyF7IqRIM,unassigned,0,https://i.redd.it/6dg6m5e556m11.jpg
137,60, Charlie Spivak and His Orchestra, I Left My Heart At the Stage Door Can'teen,1942,6TsDdnJujwhkuAzXkqqsUE,unassigned,99,https://i.scdn.co/image/204e726017af12f05d7b381dbe680eb67d25fd80
138,61, Freddy Martin and His Orchestra, Tonight We Love,1942,0Y4Uq2iVYJpOfvERQ1siqO,big band,147,https://i.scdn.co/image/1cc834084eb697a806aca96607fbc252c7174b98
139,62, Cab Calloway, Blues in the Night (My Mama Done TolMe),1942,03cwCzIWQ8BRmXjGPDAL04,big band,52512,https://i.scdn.co/image/93dfd87fdbbd41e7582555b4774280c8a6bc7720
140,63, Kay Kyser and His Orchestra, A Zoot Suit (For My Sunday Gal),1942,23NUp4EWSmMANtTosuwrGS,unassigned,2524,https://i.scdn.co/image/02be09dbaeb8c7185c1d156ac99f110b19b35d53
141,64, The Glenn Miller Orchestra, At Last,1942,7yJ74d8IUMgW1u8CHgxU6U,unassigned,268,https://i.scdn.co/image/8c0a148cd2d5033cc3dd3b44cc3c5957e6e9c6f9
142,65, Bing Crosby, Miss You,1942,6ZjFtWeHP9XN7FeKSUe80S,adult standards,186651,https://i.scdn.co/image/bce578f0f9138f68d8868b1b7c0a2b11bffaab78
143,66, Bing Crosby, I Don't Want to Walk without You,1942,6ZjFtWeHP9XN7FeKSUe80S,adult standards,186651,https://i.scdn.co/image/bce578f0f9138f68d8868b1b7c0a2b11bffaab78
144,67, Harry James and His Orchestra, Manhattan Serenade,1942,1eyNnEUKJSZP6LkQ3fRMZi,unassigned,11,https://i.redd.it/6dg6m5e556m11.jpg
145,68, Guy Lombardo and His Royal Canadians, Johnny Doughboy Found a Rose in Ireland,1942,7boMgFpwLGa82CQIC6FhuE,unassigned,494,https://i.scdn.co/image/f2904b3ca22dda2c4c6772f6d2f471ce8e8b8f22
146,69, Jimmy Dorsey and His Orchestra, Jersey Bounce,1942,3z5VqEvu6RJ4Abtah3lTsg,big band,5779,https://i.scdn.co/image/3f8668b7088547d526e23e507e24b00a10e0a6f4
147,70, Jimmy Dorsey and His Orchestra, I Remember You,1942,3z5VqEvu6RJ4Abtah3lTsg,big band,5779,https://i.scdn.co/image/3f8668b7088547d526e23e507e24b00a10e0a6f4
148,71, Harry James and His Orchestra, Hes My Guy,1942,1eyNnEUKJSZP6LkQ3fRMZi,unassigned,11,https://i.redd.it/6dg6m5e556m11.jpg
149,72, Kate Smith, (Therell Be Bluebirds Over) The White Cliffs of Dover,1942,1oTc5uL1Jrp1VwqdJrW7TT,unassigned,590,https://i.scdn.co/image/3fe77e43a09474c7db5f7ff22622a49d622cb228
150,73, The Glenn Miller Orchestra, Always in My Heart,1942,7yJ74d8IUMgW1u8CHgxU6U,unassigned,268,https://i.scdn.co/image/8c0a148cd2d5033cc3dd3b44cc3c5957e6e9c6f9
151,74, Tommy Dorsey and His Orchestra, Daybreak,1942,10nZMl7o7nE6EEXqFT0UUK,unassigned,11,https://i.scdn.co/image/ebeed20f4656e51d8f156639275b4f27fd325e86
152,75, Dinah Shore, Dearly Beloved,1942,73xrrv4ZrlpLi1q0Q34wiK,adult standards,24637,https://i.scdn.co/image/ff632972b9ff4934fc9aa280049fbf892e19776a
153,76, Benny Goodman and His Orchestra, Take Me,1942,44op4qIuRteX82594vAhMn,unassigned,867,https://i.redd.it/6dg6m5e556m11.jpg
154,77, Jimmy Dorsey and His Orchestra, My Devotion,1942,3z5VqEvu6RJ4Abtah3lTsg,big band,5779,https://i.scdn.co/image/3f8668b7088547d526e23e507e24b00a10e0a6f4
155,78, Jimmy Dorsey and His Orchestra, I Said No,1942,3z5VqEvu6RJ4Abtah3lTsg,big band,5779,https://i.scdn.co/image/3f8668b7088547d526e23e507e24b00a10e0a6f4
156,79, Lucky Millinder and His Orchestra, When the Lights Go On Again (All Over the World),1942,4q1UCLTG6CYQyaRe2o60ua,unassigned,69,https://i.scdn.co/image/16e38ed1ae68bdd4b94c5850b1b6d24362eec39b
157,80, Jimmy Dorsey and His Orchestra, Brazil (Aquarela Do Brasil),1942,3z5VqEvu6RJ4Abtah3lTsg,big band,5779,https://i.scdn.co/image/3f8668b7088547d526e23e507e24b00a10e0a6f4
158,81, Paul Whiteman & His Orchestra, TravlinLight,1942,0tIS1GWwrWqr4DHK0RLg5u,big band,2000,https://i.scdn.co/image/e6473bc823a7ee270fe2fe97d49bc62f1eddfbfe
159,83, Bing Crosby, Be Careful It's My Heart,1942,6ZjFtWeHP9XN7FeKSUe80S,adult standards,186651,https://i.scdn.co/image/bce578f0f9138f68d8868b1b7c0a2b11bffaab78
160,84, Kenny Baker, Johnny Doughboy Found a Rose in Ireland,1942,2hdWa1ITLNBBtU5CM0m2Jg,bluegrass,756,https://i.scdn.co/image/f3680f978b8e78368b64607ce5198c5ba223b373
161,85, The Merry Macs, Deep in the Heart of Texas,1942,1GdTErb29TNkiEGWrNGAeH,big band,756,https://i.scdn.co/image/a52b1fbf0828f1a6eb6367210a691536e932539d
162,86, Johnnie Johnston, Dearly Beloved,1942,2N8IGAlqW9mc9nxVlYcCuG,unassigned,5,https://i.scdn.co/image/7575b7c840172bb85d4cc4e5e79e680211c78a15
163,87, Dinah Shore, I Don't Want to Walk without You,1942,73xrrv4ZrlpLi1q0Q34wiK,adult standards,24637,https://i.scdn.co/image/ff632972b9ff4934fc9aa280049fbf892e19776a
164,88, Tommy Dorsey and His Orchestra, Manhattan Serenade,1942,10nZMl7o7nE6EEXqFT0UUK,unassigned,11,https://i.scdn.co/image/ebeed20f4656e51d8f156639275b4f27fd325e86
165,89, Tommy Dorsey and His Orchestra, Be Careful It's My Heart,1942,10nZMl7o7nE6EEXqFT0UUK,unassigned,11,https://i.scdn.co/image/ebeed20f4656e51d8f156639275b4f27fd325e86
166,90, The Glenn Miller Orchestra, American Patrol,1942,7yJ74d8IUMgW1u8CHgxU6U,unassigned,268,https://i.scdn.co/image/8c0a148cd2d5033cc3dd3b44cc3c5957e6e9c6f9
167,91, The Glenn Miller Orchestra, The Story of a Starry Night,1942,7yJ74d8IUMgW1u8CHgxU6U,unassigned,268,https://i.scdn.co/image/8c0a148cd2d5033cc3dd3b44cc3c5957e6e9c6f9
168,92, Alvino Rey and His Orchestra, I'daho,1942,4DxQK7b2NmfwBZyF7IqRIM,unassigned,0,https://i.redd.it/6dg6m5e556m11.jpg
169,93, Swing and Sway with Sammy Kaye, (Therell Be Blue Birds Over) The White Cliffs of Dover,1942,6DZ2bVND1yFu4RX1CCliFE,unassigned,14,https://i.redd.it/6dg6m5e556m11.jpg
170,94, Harry James and His Orchestra, Skylark,1942,1eyNnEUKJSZP6LkQ3fRMZi,unassigned,11,https://i.redd.it/6dg6m5e556m11.jpg
171,95, Tommy Dorsey and His Orchestra, How About You?,1942,10nZMl7o7nE6EEXqFT0UUK,unassigned,11,https://i.scdn.co/image/ebeed20f4656e51d8f156639275b4f27fd325e86
172,96, Ray Noble and His Orchestra, By the Light of the Silvry Moon,1942,6u5MW3QnHHBZ8FwzHq12DD,british dance band,872,https://i.scdn.co/image/84ebc2645264e659f4507c611216e9b6d99552b0
173,97, Freddy Martin and His Orchestra, A Touch of Texas,1942,0Y4Uq2iVYJpOfvERQ1siqO,big band,147,https://i.scdn.co/image/1cc834084eb697a806aca96607fbc252c7174b98
174,98, Gordon Jenkins and His Orchestra, White Christmas,1942,2zxOdG2ascAD3oLdP03mYU,unassigned,107,https://i.scdn.co/image/8451615d6bb93eafad1bc9bfe6d6f9d46e6f1061
175,99, Freddy Martin and His Orchestra, Johnny Doughboy Found a Rose in Ireland,1942,0Y4Uq2iVYJpOfvERQ1siqO,big band,147,https://i.scdn.co/image/1cc834084eb697a806aca96607fbc252c7174b98
176,100, Vaughn Monroe, Tangerine,1942,5TD3Mad384osX9K8DLkx7L,adult standards,5200,https://i.scdn.co/image/4a9b56f7d1333bef94bca6d986ea47767d5c0c35
